id,title
t3_202wd3,"I participated in one of the biggest Magic: the Gathering tournaments of all time this weekend. In an effort to document it, I posed for pictures near people with exposed asscracks. I present to you Grand Prix Richmond Crackstyle."
t3_25blmh,This is Carter. He knocked on my door to ask if he could have a banana then left.
t3_13q31c,"After searching FB for people with the same name as me, I'd replicate their profile pic, make it my own and send them a friend request. Here are the pics"
t3_ux56w,When I found out I could upvote by pressing 'A'
t3_15jsla,You won't escape an awkward situation by ripping off this label.
t3_x937j,We went parasailing yesterday and asked someone on the boat to take photos of us. We found this on our camera.
t3_1urmnl,I've been using this as my profile picture for my University's student portal for 3 years. Finally had a professor call me out on it today.
t3_zzmo0,The best thing about living in Switzerland
t3_29ert5,A mouse that went into Mission Impossible mode in my house last year.
t3_1kryk0,Blue screen of death.
t3_11emb0,Advertisements for my local Science Museum
t3_1ry8ko,The perfect birthday card For when you don't know what to write
t3_utq3u,I asked the lotto what is the minimum winning amount needed to get your picture taken
t3_1a3t7s,I had to make an advertisement for my photoshop class. I hope reddit enjoys! 
t3_1krtbt,So THAT'S how USB plugs work.
t3_1240dx,The Best Film Synopsis Ever
t3_xi9t7,Goddammit Mr.Noodle!
t3_2h8j9z,"The New York subway system bans canines unless they can fit in a small bag, so this guy trained his pit-bull to calmly sit in his small bag."
t3_10a8cp,Spontaneous Wingman of the Year [fb]
t3_z2322,"Hey, Shitty_Watercolor made it to CNN!"
